id|utterance|description|emotion|date_created|status|gender|age|level|audio_recording|user_id
606|The county seat is Stanton.|In an {emotion} voice, {user_id} says {transcription}. emphasising on {county seat}.|Sad|2022-07-27 10:44:53.557397|Complete|Female|20s|6|wavs/recorded_audio_mvbPF9a.webm|3
607|Living in the communal villages was mandatory.|With a {emotion} voice, {user_id} said {transcription}. Placing emphasis on {Living} and {communal}.|Happy|2022-07-27 10:45:23.558687|Complete|Female|20s|3|wavs/recorded_audio_uWyWoVO.webm|3
608|This planar chirality arises despite no single atom being a stereogenic centre.|With a {emotion} voice, {user_id} said {transcription}. Placing emphasis on {This}, and {no}.|Happy|2022-07-27 10:47:29.814266|Complete|Female|20s|2|wavs/recorded_audio_e7C4hFL.webm|3
609|Regulatory agencies or governments may issue waivers to exempt companies from certain regulations.|With a {emotion} voice, {user_id} said {transcription}. Placing emphasis on {agencies}, {waivers} and {certain}.|Sarcastic|2022-07-27 10:49:22.737176|Complete|Female|20s|2|wavs/recorded_audio_W1mXUYw.webm|3
610|He is buried at Saint Thomas' Episcopal Church Cemetery in Garrison, Maryland.|In an {emotion} voice, {user_id} says {transcription}. emphasising on {Saint} and {Garrison}.|Happy|2022-07-27 10:51:27.512859|Complete|Female|20s|2|wavs/recorded_audio_nPEuAAq.webm|3
611|They also argued that the inclusion of Migeum will alleviate traffic in the area.|{user_id} said {transcription} With a {emotion} voice. Placing emphasis on {argued} and {in the area}.|Sad|2022-07-27 10:57:13.159026|Complete|Female|20s|7|wavs/recorded_audio_mj0PfII.webm|3
612|Howard witnesses the harsh results of the right-wing Freedom Information Services.|In an {emotion} voice, {user_id} says {transcription}. emphasising on {harsh}.|Neutral|2022-07-27 10:57:58.338536|Complete|Female|20s|0|wavs/recorded_audio_6o6gT8f.webm|3
613|Its council is based in Horsham.|{transcription} said {user_id} in a {emotion} voice. Placing emphasis on {Word} and {Word}.|Angry|2022-07-27 10:58:42.007804|Needs Updating|Female|20s|8|wavs/recorded_audio_l534MBl.webm|3
614|Victorian and Tasmanian politicians were particularly active in the Federation process.|Placing emphasis on {particularly} and {Federation}, {user_id} said {transcription}.|Sad|2022-07-27 11:00:05.893022|Complete|Female|20s|7|wavs/recorded_audio_4EnrJ7B.webm|3
615|This includes three battalions of Apache attack helicopters.|With a {emotion} voice, {user_id} said {transcription}. Placing emphasis on {helicopters}.|Sad|2022-07-27 11:01:54.215824|Complete|Female|20s|7|wavs/recorded_audio_yYQJZaa.webm|3
616|Despite this, South Africa lost all their matches.|In an {emotion} voice, {user_id} says {transcription}. emphasising on {all their}.|Happy|2022-07-27 11:02:26.820597|Complete|Female|20s|2|wavs/recorded_audio_XRAtuhb.webm|3
617|He is considered to be the founder of modern orthopedic in Poland.|{transcription} said {user_id} in a {emotion} voice. Placing emphasis on {founder} and {orthopedic}.|Sad|2022-07-27 11:03:09.655866|Complete|Female|20s|6|wavs/recorded_audio_6E7NXhb.webm|3
618|Like Quechuan languages, Ayamaran languages are highly agglutinative.|In an {emotion} voice, {user_id} says {transcription}. emphasising on {highly}.|Sarcastic|2022-07-27 11:11:44.362656|Complete|Female|20s|0|wavs/recorded_audio_gMW3sLS.webm|3
619|Mayday for Nurses is a worthy cause, but there are many others.|{transcription} said {user_id} in a {emotion} voice. Placing emphasis on {worthy cause} and {many}.|Sad|2022-07-27 11:12:31.880898|Complete|Female|20s|6|wavs/recorded_audio_kQX66wA.webm|3
620|Meanwhile, the president would be elected by a mixture of the two modes.|{transcription} said {user_id} in a {emotion} voice. Placing emphasis on {mixture}.|Happy|2022-07-27 11:13:10.683992|Complete|Female|20s|0|wavs/recorded_audio_Ot3mcLJ.webm|3
621|He was silent for the best part of a minute.|In an {emotion} voice, {user_id} says {transcription}. emphasising on {silent} and {minute}.|Excited|2022-07-27 11:13:40.327934|Complete|Female|20s|9|wavs/recorded_audio_6ivw08K.webm|3
622|Chapter activities include promoting local environmental and free speech issues.|In an {emotion} voice, {user_id} says {transcription}. emphasising on {and}.|Happy|2022-07-27 11:29:18.262790|Complete|Female|20s|1|wavs/recorded_audio_kCAbSMq.webm|3
623|Colucci reportedly was planning to kill Gravano and both Speros in retaliation.|In an {emotion} voice, {user_id} says {transcription}. emphasising on {and both Speros}.|Sad|2022-07-27 11:34:49.725516|Complete|Female|20s|8|wavs/recorded_audio_puaChuW.webm|3
624|The second section is titled, A new farm crisis?|{transcription} said {user_id} in a {emotion} voice. Placing emphasis on {A new farm crisis} and {Word}.|Disgust|2022-07-27 11:35:37.450171|Complete|Female|20s|2|wavs/recorded_audio_TEOG37Y.webm|3
625|After Burns's death, Currie was entrusted with the publication of an authoritative anthology.|{transcription} said {user_id} in a {emotion} voice. Placing emphasis on {Burns's death} and {Word}.|Angry|2022-07-27 11:38:05.085115|Needs Updating|Female|20s|8|wavs/recorded_audio_utxczVJ.webm|3
626|He moved away as quietly as he had come.|In an {emotion} voice, {user_id} says {transcription}. emphasising on {quietly}.|Excited|2022-07-27 11:39:13.481491|Complete|Female|20s|7|wavs/recorded_audio_opag094.webm|3
627|Gregson had seated himself under the lamp and was sharpening a pencil.|{transcription} said {user_id} in a {emotion} voice. Placing emphasis on {Gregson} and {sharpening}.|Happy|2022-07-27 11:40:01.676059|Complete|Female|20s|2|wavs/recorded_audio_Ss4hO7q.webm|3
628|It is currently used mostly for soccer matches.|In an {emotion} voice, {user_id} says {transcription}. emphasising on {used mostly}.|Surprised|2022-07-27 11:40:26.898217|Complete|Female|20s|5|wavs/recorded_audio_kZ1ZfdW.webm|3
629|The algorithm, along with its recursive application, was invented by Carl Friedrich Gauss.|In an {emotion} voice, {user_id} says {transcription}. emphasising on {recursive}.|Disgust|2022-07-27 11:45:09.105995|Complete|Female|20s|2|wavs/recorded_audio_SezkNnL.webm|3
630|Later liberal historians would embellish this portrayal even more.|In an {emotion} voice, {user_id} says {transcription}. emphasising on {Later}, {embellish} and {even more}.|Sarcastic|2022-07-27 11:45:50.543337|Complete|Female|20s|2|wavs/recorded_audio_RniqALr.webm|3
631|The few published descriptions of Russia were in some cases wildly inaccurate.|{transcription} said {user_id} in a {emotion} voice. Placing emphasis on {Russia}, {were in some} and {inaccurate}.|Angry|2022-07-27 11:47:09.158097|Complete|Female|20s|8|wavs/recorded_audio_7jVjPoY.webm|3
632|Thank you, you've been very generous and kind!|With a {emotion} voice, {user_id} said {transcription}. Placing emphasis on {Thank you} and {very}.|Happy|2022-07-27 11:47:44.170340|Complete|Female|20s|2|wavs/recorded_audio_cWaI2pW.webm|3
633|I jumped in to save Rachel.|{transcription} said {user_id} in a {emotion} voice. Placing emphasis on {jumped in } and {save}.|Sad|2022-07-27 11:48:29.416889|Complete|Female|20s|9|wavs/recorded_audio_WiQ6FFg.webm|3
634|Please help me search The Banker television show.|In an {emotion} voice, {user_id} says {transcription}. emphasising on {search}.|Happy|2022-07-27 11:49:12.407986|Complete|Female|20s|2|wavs/recorded_audio_HQ09mgK.webm|3
635|What's that book you've got there?|With a {emotion} voice, {user_id} said {transcription}. Placing emphasis on {there}.|Excited|2022-07-27 11:49:37.799701|Complete|Female|20s|8|wavs/recorded_audio_4dylUpD.webm|3
636|This large vein is formed by the brachial vein and the basilic vein.|{user_id} said {transcription} With a {emotion} voice. Placing emphasis on {and the basilic}.|Neutral|2022-07-27 11:51:33.819726|Complete|Female|20s|0|wavs/recorded_audio_ehUac6O.webm|3
637|At the common focal point superposition of both focused light beams occurs.|{transcription} said {user_id} in a {emotion} voice. Placing emphasis on {common focal point} and {occurs}.|Disgust|2022-07-27 11:53:42.504241|Complete|Female|20s|2|wavs/recorded_audio_z2sp9fN.webm|3
638|Unauthorized thinking of it is prohibited.|In an {emotion} voice, {user_id} says {transcription}. emphasising on {it}.|Angry|2022-07-27 11:54:55.031685|Complete|Female|20s|8|wavs/recorded_audio_Z6kyVNw.webm|3
639|"""I just decided to not write normal songs"", recalled Stevenson."|{transcription} said {user_id} in a {emotion} voice. Placing emphasis on {Stevenson}.|Surprised|2022-07-27 11:56:39.859504|Complete|Female|20s|4|wavs/recorded_audio_rlBCvLM.webm|3
640|"Sections of the river are closed to fishing, or are ""catch-and-release"" waters."|{user_id} said {transcription} With a {emotion} voice. Placing emphasis on {or} and {catch}.|Happy|2022-07-27 11:57:10.825133|Complete|Female|20s|2|wavs/recorded_audio_cPmT239.webm|3
641|She has appeared on the covers of several Philippine magazines.|With a {emotion} voice, {user_id} said {transcription}. Placing emphasis on {covers} and {several Philippine}.|Sad|2022-07-27 11:58:18.394709|Complete|Female|20s|8|wavs/recorded_audio_1P2gd1r.webm|3
642|"""Drawing Hands"" has been referenced and copied many times by artists in different ways."|"{user_id} said {transcription} With a {emotion} voice. Placing emphasis on {""Drawing Hands""}."|Happy|2022-07-27 12:01:25.522732|Complete|Female|20s|2|wavs/recorded_audio_6oXuj0U.webm|3
643|Kirknewton was the terminus of the Slateford-Balerno line.|In an {emotion} voice, {user_id} says {transcription}. emphasising on {Balerno line}.|Excited|2022-07-27 12:03:50.370316|Complete|Female|20s|7|wavs/recorded_audio_Z78h3d0.webm|3
644|He also played school dances with his own band, Corny and the Corvettes.|In an {emotion} voice, {user_id} says {transcription}. emphasising on {his own band} and {Corny and the Corvettes}.|Angry|2022-07-27 12:04:41.543632|Complete|Female|20s|8|wavs/recorded_audio_rFgbkwP.webm|3
645|The cryptoperiod was still usually one day.|{user_id} said {transcription} With a {emotion} voice. Placing emphasis on {usually} and {one day}.|Sad|2022-07-27 12:05:15.377584|Complete|Female|20s|8|wavs/recorded_audio_xHeQ6lW.webm|3
646|Her mother, Eleanore, was a columnist for the Los Angeles Examiner.|With a {emotion} voice, {user_id} said {transcription}. Placing emphasis on {Eleanore}.|Neutral|2022-07-27 12:07:44.528018|Complete|Female|20s|0|wavs/recorded_audio_3Z7msHZ.webm|3
647|All of these flagship titles were co-created by Dwayne McDuffie.|{user_id} said {transcription} With a {emotion} voice. Placing emphasis on {co-created} and {Dwayne McDuffie}.|Angry|2022-07-27 12:08:25.135599|Complete|Female|20s|7|wavs/recorded_audio_Tvpwv0o.webm|3
648|No was born in northern Korea when the country was occupied by the Japanese.|{transcription} said {user_id} in a {emotion} voice. Placing emphasis on {country} and {Japanese}.|Excited|2022-07-27 12:09:11.845476|Complete|Female|20s|9|wavs/recorded_audio_08AxQ5T.webm|3
649|Graham and Bledel only met the night before they started filming the pilot.|{transcription} said {user_id} in a {emotion} voice. Placing emphasis on {only met}, {started} and {the pilot}.|Disgust|2022-07-27 12:12:19.667141|Complete|Female|20s|0|wavs/recorded_audio_0kxS3Qd.webm|3
650|It is the county seat of Campbell County.|With a {emotion} voice, {user_id} said {transcription}. Placing emphasis on {Campbell County} and {Campbell County}.|Sad|2022-07-27 12:12:59.981635|Complete|Female|20s|7|wavs/recorded_audio_WuUnP0R.webm|3
651|She is known as the lead singer of Eurodance and Eurotrance group Cascada.|In an {emotion} voice, {user_id} says {transcription}. emphasising on {known}.|Neutral|2022-07-27 12:15:02.195496|Complete|Female|20s|0|wavs/recorded_audio_WvFXQZK.webm|3
652|He was widely praised for his grasp of the legislation.|{user_id} said {transcription} With a {emotion} voice. Placing emphasis on {widely praised} and {grasp}.|Excited|2022-07-27 12:15:37.426764|Complete|Female|20s|6|wavs/recorded_audio_e4Jr1WN.webm|3
653|Moore's charity work includes raising money for the fight against Scleroderma.|{transcription} said {user_id} in a {emotion} voice. Placing emphasis on {includes} and {raising}.|Sad|2022-07-27 12:16:48.195122|Complete|Female|20s|7|wavs/recorded_audio_RpsB2D1.webm|3
654|However it has since been widely used by other documentary filmmakers.|{transcription} said {user_id} in a {emotion} voice. Placing emphasis on {However}, {widely used} and {filmmakers}.|Surprised|2022-07-27 12:19:04.593973|Complete|Female|20s|5|wavs/recorded_audio_CN2hxd4.webm|3
655|She works as an advice columnist, writer, broadcaster, consultant, trainer and coach.|{user_id} said {transcription} With a {emotion} voice. Placing emphasis on {advice} and {writer, broadcaster, consultant, trainer and coach}.|Sarcastic|2022-07-27 12:20:53.893492|Complete|Female|20s|4|wavs/recorded_audio_LkkDRvk.webm|3
656|A slapper or smacker may also be used.|{transcription} said {user_id} in a {emotion} voice. Placing emphasis on {slapper or smacker}.|Neutral|2022-07-27 12:21:47.719030|Complete|Female|20s|0|wavs/recorded_audio_C3aqnQR.webm|3
657|Luther and Cody Dickinson's father was the Memphis musician and record producer Jim Dickinson.|In an {emotion} voice, {user_id} says {transcription}. emphasising on {and Cody} and {record producer Jim Dickinson}.|Surprised|2022-07-27 12:23:01.385480|Complete|Female|20s|6|wavs/recorded_audio_y8QuGBT.webm|3
658|It was also the first mission of the Luna programme.|{user_id} said {transcription} With a {emotion} voice. Placing emphasis on {also}, {first} and {Luna programme}.|Disgust|2022-07-27 12:23:38.575351|Complete|Female|20s|3|wavs/recorded_audio_ks35cg2.webm|3
659|Another ireful king, Cambises, was a drunk.|{user_id} said {transcription} With a {emotion} voice. Placing emphasis on {ireful king} and {a drunk}.|Excited|2022-07-27 12:27:04.370911|Complete|Female|20s|7|wavs/recorded_audio_rguPlLs.webm|3
660|This triple tonguing method is most likely the fastest if done correctly.|{user_id} said {transcription} With a {emotion} voice. Placing emphasis on {triple tonguing}, {fastest} and {correctly}.|Excited|2022-07-27 12:28:59.995915|Complete|Female|20s|8|wavs/recorded_audio_w5IGBKb.webm|3
661|The satellite was constructed from aluminum and used graphite struts.|{transcription} said {user_id} in a {emotion} voice. Placing emphasis on {satellite} and {satellite}.|Angry|2022-07-27 12:31:20.844671|Complete|Female|20s|8|wavs/recorded_audio_sR15M45.webm|3
662|However, both propellants are extremely toxic.|{transcription} said {user_id} in a {emotion} voice. Placing emphasis on {both propellants} and {extremely toxic}.|Surprised|2022-07-27 12:32:05.926793|Complete|Female|20s|3|wavs/recorded_audio_Gqa3z7g.webm|3
663|She sank instantly; there were no survivors.|In an {emotion} voice, {user_id} says {transcription}. emphasising on {instantly} and {no survivors}.|Disgust|2022-07-27 12:32:45.323004|Complete|Female|20s|3|wavs/recorded_audio_AgufqzX.webm|3
664|Their mutual grandfather was president of the students union at the University.|{user_id} said {transcription} With a {emotion} voice. Placing emphasis on {Their}, {president} and {University}.|Sarcastic|2022-07-27 12:33:13.550945|Complete|Female|20s|5|wavs/recorded_audio_3yiuO0X.webm|3
665|The Akron Pros ended the season as the only undefeated team in the Association.|{transcription} said {user_id} in a {emotion} voice. Placing emphasis on {season}, {undefeated} and {Association}.|Sad|2022-07-27 12:34:06.544143|Complete|Female|20s|8|wavs/recorded_audio_jV9wsdD.webm|3
666|There were no bonus features.|{user_id} said {transcription} With a {emotion} voice. Placing emphasis on {no bonus features}.|Surprised|2022-07-27 12:34:21.468293|Complete|Female|20s|3|wavs/recorded_audio_iIafeNu.webm|3
667|Pompey defeated the Jewish armies in multiple battles, and took the fortresses of Judea.|In an {emotion} voice, {user_id} says {transcription}. emphasising on {Jewish armies}, {and} and {Judea}.|Sad|2022-07-27 12:35:59.525356|Complete|Female|20s|7|wavs/recorded_audio_SnNZ2eY.webm|3
668|"""Ruthenians"" and ""Ruthenes"" are now rarely used by Rusyns or Ukrainians."|{user_id} said {transcription} With a {emotion} voice. Placing emphasis on {rarely} and {or}.|Happy|2022-07-27 12:38:57.732893|Complete|Female|20s|2|wavs/recorded_audio_Nmg2Ils.webm|3
669|A disease is an abnormal condition affecting the body of an organism.|{user_id} said {transcription} With a {emotion} voice. Placing emphasis on {disease}.|Neutral|2022-07-27 12:40:01.129071|Complete|Female|20s|0|wavs/recorded_audio_79NOSGu.webm|3
670|Scuba diving off Cienfuegos province is extremely popular both with tourists and locals.|{user_id} said {transcription} With a {emotion} voice. Placing emphasis on {extremely popular} and {tourists and locals}.|Sarcastic|2022-07-27 12:42:42.611510|Complete|Female|20s|4|wavs/recorded_audio_i4XrWXa.webm|3
671|The last of the petrol engines was designed by Watson himself.|In an {emotion} voice, {user_id} says {transcription}. emphasising on {The last of} and {was designed}.|Happy|2022-07-27 12:43:28.982053|Complete|Female|20s|4|wavs/recorded_audio_vNT3hty.webm|3
672|"Both recordings cover topics such as ""The Italian Job"", Pavlov's dogs and European languages."|With a {emotion} voice, {user_id} said {transcription}. Placing emphasis on {and}.|Happy|2022-07-27 12:44:42.917298|Complete|Female|20s|3|wavs/recorded_audio_VdZQUAd.webm|3
673|These are separate tokens, and so will remain as such in the program listing.|With a {emotion} voice, {user_id} said {transcription}. Placing emphasis on {These} and {will remain}.|Happy|2022-07-27 12:45:14.423044|Complete|Female|20s|3|wavs/recorded_audio_40VLzQ9.webm|3
674|He is also the patron of the church and town of Bocaue.|With a {emotion} voice, {user_id} said {transcription}. Placing emphasis on {and town}.|Excited|2022-07-27 12:47:39.101926|Complete|Female|20s|8|wavs/recorded_audio_g9Psjl0.webm|3
675|Rebuilding began immediately, and at an impressive pace.|{user_id} said {transcription} With a {emotion} voice. Placing emphasis on {immediately}, {and} and {impressive pace}.|Disgust|2022-07-27 12:48:15.188962|Complete|Female|20s|3|wavs/recorded_audio_dtexXHi.webm|3
676|The practice has a reputation for designing modernist, yet stylistically restrained buildings.|With a {emotion} voice, {user_id} said {transcription}. Placing emphasis on {reputation} and {restrained}.|Neutral|2022-07-27 12:49:18.996293|Complete|Female|20s|0|wavs/recorded_audio_OtXtoN5.webm|3
677|Successful candidates are highlighted in the relevant colour.|{user_id} said {transcription} With a {emotion} voice. Placing emphasis on {candidates}, {highlighted} and {colour}.|Disgust|2022-07-27 12:49:51.437092|Complete|Female|20s|2|wavs/recorded_audio_9x6nZhj.webm|3
678|These newspapers intensified their negative attitudes instead and attacked openly the regime in Ankara.|{user_id} said {transcription} With a {emotion} voice. Placing emphasis on {intensified}, {instead}, {openly} and {regime}.|Sad|2022-07-27 12:51:51.297281|Complete|Female|20s|7|wavs/recorded_audio_ONH9BHa.webm|3
679|The software can run under their respective operating systems natively without emulation.|In an {emotion} voice, {user_id} says {transcription}. emphasising on {can run}, {respective} and {without emulation}.|Disgust|2022-07-27 12:53:43.636482|Complete|Female|20s|4|wavs/recorded_audio_M6Mi56h.webm|3
680|"The pens are also a popular advertising medium and considered a ""premium"" promotion."|"With a {emotion} voice, {user_id} said {transcription}. Placing emphasis on {are also}, {popular} {and considered a} and {""premium"" promotion}."|Disgust|2022-07-27 12:54:25.590377|Complete|Female|20s|2|wavs/recorded_audio_bfChwyE.webm|3
681|Despite these changes, the album nevertheless received rave reviews upon its release.|{user_id} said {transcription} With a {emotion} voice. Placing emphasis on {the album} and {rave reviews}.|Excited|2022-07-27 12:55:41.334624|Complete|Female|20s|6|wavs/recorded_audio_v8Cauqs.webm|3
682|However, his achievements in outdoor races remained mixed.|In an {emotion} voice, {user_id} says {transcription}. emphasising on {achievements}.|Neutral|2022-07-27 12:56:19.004323|Complete|Female|20s|0|wavs/recorded_audio_Q1Gr0Jz.webm|3
683|He also became an active member of the Pattern Makers Union.|{user_id} said {transcription} With a {emotion} voice. Placing emphasis on {also} and {Pattern Makers Union}.|Excited|2022-07-27 12:56:47.653590|Complete|Female|20s|7|wavs/recorded_audio_NRtuPVT.webm|3
684|One was the portrait of John Kennedy, the other Ronald Reagan.|Placing emphasis on {Word} and {Word}, {user_id} said {transcription}.|Angry|2022-07-27 12:58:05.276987|Needs Updating|Female|20s|8|wavs/recorded_audio_KnLwZpQ.webm|3
685|Experimental burns were also recommended to encourage the growth of suitable spinifex habitat.|With a {emotion} voice, {user_id} said {transcription}. Placing emphasis on {burns}, {also} and {suitable}.|Sarcastic|2022-07-27 12:59:59.643750|Complete|Female|20s|2|wavs/recorded_audio_MRMlFrW.webm|3
686|He was born in Atlanta, Georgia.|With a {emotion} voice, {user_id} said {transcription}. Placing emphasis on {in Atlanta, Georgia}.|Disgust|2022-07-27 13:00:38.070972|Complete|Female|20s|3|wavs/recorded_audio_1EeZukq.webm|3
687|Access, inclusion and quality are among the main challenges they can address.|{user_id} said {transcription} With a {emotion} voice. Placing emphasis on {Access, inclusion and quality}.|Angry|2022-07-27 13:01:17.840525|Complete|Female|20s|8|wavs/recorded_audio_M0GQbbV.webm|3
688|One, she must agree to be installed at a temple after one year.|{user_id} said {transcription} With a {emotion} voice. Placing emphasis on {agree}, {installed} and {one}.|Sad|2022-07-27 13:01:57.612769|Complete|Female|20s|6|wavs/recorded_audio_70lCGDM.webm|3
689|"The specific origins of ""Irene"" are unclear."|{transcription} said {user_id} in a {emotion} voice. Placing emphasis on {Word} and {Word}.|Disgust|2022-07-27 13:02:49.559131|Needs Updating|Female|20s|3|wavs/recorded_audio_0ki1DKs.webm|3
690|Chukchansi also has a phrase book and dictionary that are partially completed.|With a {emotion} voice, {user_id} said {transcription}. Placing emphasis on {also} and {and}.|Happy|2022-07-27 13:05:22.648137|Complete|Female|20s|3|wavs/recorded_audio_W5EXMUn.webm|3
691|Premier Division Champions.|In an {emotion} voice, {user_id} says {transcription}. emphasising on {Word} and {Word}.|Excited|2022-07-27 13:05:45.859808|Needs Updating|Female|20s|9|wavs/recorded_audio_HDXgKvK.webm|3
692|The added pressure weakened Rosebery.|{user_id} said {transcription} With a {emotion} voice. Placing emphasis on {pressure} and {Rosebery}.|Disgust|2022-07-27 13:06:45.522702|Complete|Female|20s|4|wavs/recorded_audio_WX3yTDA.webm|3
693|The colours of the club consist of red and white vertical stripes.|With a {emotion} voice, {user_id} said {transcription}. Placing emphasis on {red and white}.|Happy|2022-07-27 13:07:24.058100|Complete|Female|20s|3|wavs/recorded_audio_aC7nvFi.webm|3
694|The following are the listed buildings in Keswick.|Placing emphasis on {listed} and {Word}, {user_id} said {transcription}.|Happy|2022-07-27 13:08:09.394803|Complete|Female|20s|2|wavs/recorded_audio_ItBDShw.webm|3
695|This was seen as an early sign that Scotland would vote against independence.|In an {emotion} voice, {user_id} says {transcription}. emphasising on {seen}, {Scotland} and {against}.|Neutral|2022-07-27 13:08:40.454489|Complete|Female|20s|0|wavs/recorded_audio_ly77r84.webm|3
696|Moscow City has a considerable share of stock of the plant.|{transcription} said {user_id} in a {emotion} voice. Placing emphasis on {considerable share} and {the plant}.|Excited|2022-07-27 13:09:04.624511|Complete|Female|20s|8|wavs/recorded_audio_iqI0GbR.webm|3
697|He was narrowly defeated by Dahir Riyale Kahin.|With a {emotion} voice, {user_id} said {transcription}. Placing emphasis on {defeated}.|Angry|2022-07-27 13:12:20.342638|Complete|Female|20s|7|wavs/recorded_audio_ckkGJ8v.webm|3
698|It houses a canvas by Luca Giordano.|In an {emotion} voice, {user_id} says {transcription}. emphasising on {canvas} and {Luca Giordano}.|Disgust|2022-07-27 13:14:22.002902|Complete|Female|20s|3|wavs/recorded_audio_UCuYMb6.webm|3
699|She is also the mother of Mixcoatl, whom she abandoned at a crossroads.|With a {emotion} voice, {user_id} said {transcription}. Placing emphasis on {whom}.|Neutral|2022-07-27 13:16:20.676102|Complete|Female|20s|0|wavs/recorded_audio_tKJvqya.webm|3
700|Sally has wanted Charlie Brown's bedroom for years.|{user_id} said {transcription} With a {emotion} voice. Placing emphasis on {Sally}, {Charlie Brown's} and {for years}.|Disgust|2022-07-27 13:16:55.763958|Complete|Female|20s|3|wavs/recorded_audio_JIv7bfX.webm|3
701|The executive of the urban agglomeration is the agglomeration council.|In an {emotion} voice, {user_id} says {transcription}. emphasising on {urban agglomeration} and {agglomeration}.|Surprised|2022-07-27 13:18:11.445418|Complete|Female|20s|4|wavs/recorded_audio_DvJfMoN.webm|3
702|As Jehovah's Witnesses we do not believe in creature worship...|Placing emphasis on {As Jehovah's Witnesses} and {do not believe}, {user_id} said {transcription}.|Disgust|2022-07-27 13:18:45.419579|Complete|Female|20s|6|wavs/recorded_audio_DMJxZwx.webm|3
703|Dallaire is an outspoken supporter of raising awareness for veterans' mental health.|With a {emotion} voice, {user_id} said {transcription}. Placing emphasis on {veterans'}.|Excited|2022-07-27 13:20:58.820457|Complete|Female|20s|8|wavs/recorded_audio_d46aQln.webm|3
704|There is a re-introduction scheme in Fennoscandia.|{user_id} said {transcription} With a {emotion} voice. Placing emphasis on {re-introduction}.|Happy|2022-07-27 13:23:04.902453|Complete|Female|20s|3|wavs/recorded_audio_uNvAwrl.webm|3
