id|utterance|description|emotion|date_created|status|gender|age|level|audio_recording|user_id
905|He read English Literature at Trinity College, Cambridge.|{user_id} said {transcription} With a {emotion} voice. Placing emphasis on {English Literature}.|Sarcastic|2022-07-29 14:00:47.794933|Complete|Female|20s|2|wavs/recorded_audio_ZzzSe40.webm|3
906|Two galleasses each were assigned to the wings and center.|In an {emotion} voice, {user_id} says {transcription}. emphasising on {assigned} and {wings}.|Sarcastic|2022-07-29 14:02:05.704372|Complete|Female|20s|0|wavs/recorded_audio_62f2nPB.webm|3
907|Born in Ayr, Ure started his career as a centre half with Ayr Albion.|{transcription} said {user_id} in a {emotion} voice. Placing emphasis on {Ayr}, {Ure}, {career} and {centre half}.|Disgust|2022-07-29 14:05:44.650508|Complete|Female|20s|3|wavs/recorded_audio_uXbD2lt.webm|3
908|Higher-gain omnidirectional antennas can also be built.|With a {emotion} voice, {user_id} said {transcription}. Placing emphasis on {Higher-gain} and {also be built}.|Sad|2022-07-29 14:06:48.183538|Complete|Female|20s|6|wavs/recorded_audio_TXLHXZj.webm|3
909|They were operated in the city of Perth, the capital of Western Australia.|{transcription} said {user_id} in a {emotion} voice. Placing emphasis on {city of Perth} and {Western Australia}.|Angry|2022-07-29 14:07:12.178066|Complete|Female|20s|8|wavs/recorded_audio_UJufLyM.webm|3
910|The newest one opened in Rochester, New Hampshire.|With a {emotion} voice, {user_id} said {transcription}. Placing emphasis on {newest one} and {New Hampshire}.|Surprised|2022-07-29 14:08:08.890915|Complete|Female|20s|6|wavs/recorded_audio_BrtV02W.webm|3
911|The rest are of steel lattice construction.|With a {emotion} voice, {user_id} said {transcription}. Placing emphasis on {rest} and {steel lattice construction}.|Excited|2022-07-29 14:08:57.102149|Complete|Female|20s|7|wavs/recorded_audio_FeompJs.webm|3
912|Mulla Sadra was a master of all science of his time.|With a {emotion} voice, {user_id} said {transcription}. Placing emphasis on {master} and {all science}.|Sad|2022-07-29 14:09:45.756464|Complete|Female|20s|7|wavs/recorded_audio_ArpwYVF.webm|3
913|Mumps can be prevented by immunization.|{user_id} said {transcription} With a {emotion} voice. Placing emphasis on {Mumps}, {prevented} and {immunization}.|Angry|2022-07-29 14:10:40.849413|Complete|Female|20s|8|wavs/recorded_audio_6GyryxM.webm|3
914|The new stave church was built on the site, dedicated to Saint Michael.|Placing emphasis on {new stave church}, {user_id} said {transcription}, in an {emotion} voice.|Surprised|2022-07-29 14:11:05.962255|Complete|Female|20s|5|wavs/recorded_audio_9lLqk2c.webm|3
915|Russia and China used this as a source for germanium.|With a {emotion} voice, {user_id} said {transcription}. Placing emphasis on {Russia and China} and {germanium}.|Disgust|2022-07-29 14:12:43.306922|Complete|Female|20s|3|wavs/recorded_audio_flZhdTA.webm|3
916|Here she studied jazz with Marcus Belgrave.|Placing emphasis on {studied jazz}, {user_id} said {transcription}, in an {emotion} voice.|Happy|2022-07-29 14:13:05.761270|Complete|Female|20s|1|wavs/recorded_audio_8jlleSY.webm|3
917|The award itself has also gone through many changes.|{transcription} said {user_id} in a {emotion} voice. Placing emphasis on {itself} and {also}.|Surprised|2022-07-29 14:13:28.152057|Complete|Female|20s|3|wavs/recorded_audio_6quJ5LT.webm|3
918|She was named for John Paul Jones.|Placing emphasis on {She} and {John Paul Jones}, {user_id} said {transcription}, in an {emotion} voice.|Disgust|2022-07-29 14:13:47.240023|Complete|Female|20s|3|wavs/recorded_audio_v2Sscx0.webm|3
919|It is part of the Hauts-de-France region.|In an {emotion} voice, {user_id} says {transcription}. emphasising on {Hauts-de-France}.|Happy|2022-07-29 14:14:48.606720|Complete|Female|20s|1|wavs/recorded_audio_vLFYvqO.webm|3
920|The words were written by Fred U. Wolfe, an agriculture teacher at Gold Sand.|With a {emotion} voice, {user_id} said {transcription}. Placing emphasis on {Fred U. Wolfe} and {teacher}.|Surprised|2022-07-29 14:15:29.864617|Complete|Female|20s|4|wavs/recorded_audio_JXwfTwv.webm|3
921|The party's president is Mirnes Ajanovic.|{user_id} said {transcription} With a {emotion} voice. Placing emphasis on {party's} and {Mirnes Ajanovic}.|Happy|2022-07-29 14:17:37.883761|Complete|Female|20s|0|wavs/recorded_audio_t7bDMzY.webm|3
922|"""Bracket style"" has sometimes been referred to as a ""gun drag race""."|"In an {emotion} voice, {user_id} says {transcription}. emphasising on {""Bracket style""}, {referred to} and {""gun drag race""}."|Disgust|2022-07-29 14:18:21.699944|Complete|Female|20s|2|wavs/recorded_audio_PsiLm8R.webm|3
923|In addition, he collected their oral histories.|With a {emotion} voice, {user_id} said {transcription}. Placing emphasis on {oral histories}.|Excited|2022-07-29 14:19:20.481947|Complete|Female|20s|6|wavs/recorded_audio_SW8Ub1i.webm|3
924|A resident mine worker was entrusted to oversee the natural monument.|{transcription} said {user_id} in a {emotion} voice. Placing emphasis on {mine worker}, {entrusted} and {natural monument}.|Angry|2022-07-29 14:20:22.796310|Complete|Female|20s|8|wavs/recorded_audio_TWd4gyL.webm|3
925|The nakshatra's symbol is a coiled serpent.|With a {emotion} voice, {user_id} said {transcription}. Placing emphasis on {coiled serpent}.|Excited|2022-07-29 14:21:15.408811|Complete|Female|20s|9|wavs/recorded_audio_OzUEoUs.webm|3
926|"Although ""Vossa Senhoria"" is regarded as protocolar, it is an equalizing form."|With a {emotion} voice, {user_id} said {transcription}. Placing emphasis on {Although} and {equalizing}.|Disgust|2022-07-29 14:25:12.270793|Complete|Female|20s|4|wavs/recorded_audio_BcljmDc.webm|3
927|Birdwood was originally named Blumberg, by Prussian settlers originating from the area around Zullichau.|In an {emotion} voice, {user_id} says {transcription}. emphasising on {Birdwood}, {originally}, {Prussian settlers} and {Zullichau}.|Sarcastic|2022-07-29 14:29:04.561721|Complete|Female|20s|1|wavs/recorded_audio_GmSuhu1.webm|3
928|"This ideal from which the peculiarities were effaced became ""the average man""."|"In an {emotion} voice, {user_id} says {transcription}. emphasising on {became} and {""the average man""}."|Disgust|2022-07-29 14:30:12.562499|Complete|Female|20s|2|wavs/recorded_audio_rRMsNHI.webm|3
929|Her memoir chronicles the inner struggles and problems the family faced at the time.|{user_id} said {transcription} With a {emotion} voice. Placing emphasis on {memoir chronicles} and {at the time}.|Angry|2022-07-29 14:31:47.735184|Complete|Female|20s|8|wavs/recorded_audio_fjuCjCL.webm|3
930|An agreement was also reached about improving access to the station.|In an {emotion} voice, {user_id} says {transcription}. emphasising on {reached} and {improving}.|Happy|2022-07-29 14:32:10.802266|Complete|Female|20s|3|wavs/recorded_audio_Wj40kLb.webm|3
931|It is located four miles north of downtown Pittsburgh, Pennsylvania at Riverview Park.|{user_id} said {transcription} With a {emotion} voice. Placing emphasis on {four miles north}.|Neutral|2022-07-29 14:33:09.420766|Complete|Female|20s|0|wavs/recorded_audio_AKiOumJ.webm|3
932|Membership is through appointment by the Supervisors.|{transcription} said {user_id} in a {emotion} voice. Placing emphasis on {Membership}, {appointment} and {Supervisors}.|Surprised|2022-07-29 14:33:36.363283|Complete|Female|20s|5|wavs/recorded_audio_ntvSYLZ.webm|3
933|Peg Bennett was active during her tenure as First Lady of New Jersey.|{transcription} said {user_id} in a {emotion} voice. Placing emphasis on {active} and {First Lady}.|Happy|2022-07-29 14:35:13.089013|Complete|Female|20s|1|wavs/recorded_audio_20EaVyk.webm|3
934|But the tragedy of war was never far away.|{transcription} said {user_id} in a {emotion} voice. Placing emphasis on {war} and {never far away}.|Sad|2022-07-29 14:35:58.907528|Complete|Female|20s|9|wavs/recorded_audio_w5RdQag.webm|3
935|The Big Chicken is commonly used as a landmark for driving directions.|Placing emphasis on {landmark}, {user_id} said {transcription}, in an {emotion} voice.|Excited|2022-07-29 14:36:24.011588|Complete|Female|20s|9|wavs/recorded_audio_lu1aRag.webm|3
936|The unincorporated communities of Goll, McAllister, Packard, and Wagner are located in the town.|With a {emotion} voice, {user_id} said {transcription}. Placing emphasis on {communities} and {and Wagner}.|Sad|2022-07-29 14:37:35.292664|Complete|Female|20s|9|wavs/recorded_audio_jP9mHtS.webm|3
937|New Zealand, Canada, and the United Kingdom have considered similar policies.|{transcription} said {user_id} in a {emotion} voice. Placing emphasis on {New Zealand, Canada, and the United Kingdom}.|Surprised|2022-07-29 14:38:03.008150|Complete|Female|20s|7|wavs/recorded_audio_GrC4KwO.webm|3
938|Without such a regime, transparency is simply not attainable.|With a {emotion} voice, {user_id} said {transcription}. Placing emphasis on {such} and {not}.|Excited|2022-07-29 14:38:59.297816|Complete|Female|20s|6|wavs/recorded_audio_5mAMArA.webm|3
939|The rings are not planar, but are twisted in three dimensions.|In an {emotion} voice, {user_id} says {transcription}. emphasising on {are not planar} and {three dimensions}.|Angry|2022-07-29 14:39:35.841339|Complete|Female|20s|10|wavs/recorded_audio_kCcRVu5.webm|3
940|The riding includes portions of the former cities of North York, Toronto, and York.|{transcription} said {user_id} in a {emotion} voice. Placing emphasis on {The riding}, {former} and {North York, Toronto, and York}.|Disgust|2022-07-29 14:40:20.411479|Complete|Female|20s|3|wavs/recorded_audio_1VdoWnf.webm|3
941|When a Null is passed into this function, the function returns Null.|Placing emphasis on {function} and {Word}, {user_id} said {transcription}, in an {emotion} voice.|Sarcastic|2022-07-29 14:41:22.669915|Complete|Female|20s|2|wavs/recorded_audio_Gl9TxLu.webm|3
942|Oh, is it bad?|With a {emotion} voice, {user_id} said {transcription}. Placing emphasis on {Oh}.|Neutral|2022-07-29 14:41:46.997720|Complete|Female|20s|0|wavs/recorded_audio_ZPjdi0o.webm|3
943|Modern networks have to carry integrated traffic consisting of voice, video and data.|With a {emotion} voice, {user_id} said {transcription}. Placing emphasis on {and}.|Sarcastic|2022-07-29 14:42:51.541513|Complete|Female|20s|0|wavs/recorded_audio_gw2IdnC.webm|3
944|Throughout the series, his portrayal of Snape garnered widespread critical acclaim.|Placing emphasis on {portrayal of Snape}, {user_id} said {transcription}, in an {emotion} voice.|Neutral|2022-07-29 14:43:35.270898|Complete|Female|20s|0|wavs/recorded_audio_BCewNFH.webm|3
945|The line-up included Grinspoon, Paul Kelly, Killing Heidi, Silverchair, Powderfinger and Alex Lloyd.|Placing emphasis on {Alex Lloyd}, {user_id} said {transcription}, in an {emotion} voice.|Sarcastic|2022-08-02 12:32:05.074915|Complete|Female|20s|1|wavs/recorded_audio_wXmff1Y.webm|3
946|He was a perfect operator, and one of the most trustworthy of counsellors.|Placing emphasis on {He}, {perfect} and {trustworthy}, {user_id} said {transcription}, in an {emotion} voice.|Happy|2022-08-02 12:33:23.439166|Complete|Female|20s|2|wavs/recorded_audio_qQRuJvK.webm|3
947|She specialises in black-and-white photography.|Placing emphasis on {black-and-white}, {user_id} said {transcription}, in an {emotion} voice.|Sad|2022-08-02 12:33:58.457147|Complete|Female|20s|8|wavs/recorded_audio_XiOefKV.webm|3
948|"At the age of six, she appeared on ""Candid Camera""."|"Placing emphasis on {six}, {she} and {""Candid Camera""}, {user_id} said {transcription}, in an {emotion} voice."|Angry|2022-08-02 12:34:50.245710|Complete|Female|20s|7|wavs/recorded_audio_FesYDMF.webm|3
949|Ignoring these orders, the Marines continued to resist.|{user_id} said {transcription} With a {emotion} voice. Placing emphasis on {Word} and {Word}.|Angry|2022-08-02 12:35:30.271272|Needs Updating|Female|20s|8|wavs/recorded_audio_mxc7lNI.webm|3
950|He was the eldest son of John Greaves, rector of Colemore, and Sarah Greaves.|Placing emphasis on {He} and {John Greaves}, {user_id} said {transcription}, in an {emotion} voice.|Happy|2022-08-02 12:36:23.570996|Complete|Female|20s|0|wavs/recorded_audio_a6Y2gNE.webm|3
951|He also played for the Wigan Warriors in the English Super League competition.|{transcription} said {user_id} in a {emotion} voice. Placing emphasis on {Wigan Warriors} and {Super League}.|Sarcastic|2022-08-02 12:37:09.633185|Complete|Female|20s|0|wavs/recorded_audio_tr7BJnm.webm|3
952|Since that time the company has published six more comic books featuring the characters.|{transcription} said {user_id} in a {emotion} voice. Placing emphasis on {Since that time} and {six more}.|Excited|2022-08-02 12:38:06.269312|Complete|Female|20s|7|wavs/recorded_audio_zLpEd12.webm|3
953|Use of the pingers has been shown to significantly reduce marine mammal bycatch.|With a {emotion} voice, {user_id} said {transcription}. Placing emphasis on {pingers}.|Neutral|2022-08-02 12:39:14.806003|Complete|Female|20s|0|wavs/recorded_audio_0UbW71l.webm|3
954|His work was noteworthy enough to attain mention in Leo Tolstoy's novel, Anna Karenina.|{transcription} said {user_id} in a {emotion} voice. Placing emphasis on {attain}.|Sad|2022-08-02 12:42:55.295088|Complete|Female|20s|7|wavs/recorded_audio_DAvJf4q.webm|3
955|The single-player and multi-player game feature drivable vehicles that may be used in combat.|Placing emphasis on {single-player and multi-player} and {that may}, {user_id} said {transcription}, in an {emotion} voice.|Sarcastic|2022-08-02 12:44:12.974942|Complete|Female|20s|0|wavs/recorded_audio_iKVg5rU.webm|3
956|They break down information to determine its usefulness in military planning.|In an {emotion} voice, {user_id} says {transcription}. emphasising on {determine}.|Neutral|2022-08-02 12:45:03.473547|Complete|Female|20s|0|wavs/recorded_audio_XYYpJzs.webm|3
957|The train wrecked crossing a trestle bridge purportedly dynamited by union members.|In an {emotion} voice, {user_id} says {transcription}. emphasising on {wrecked}, {purportedly} and {union}.|Sad|2022-08-02 12:46:56.082880|Complete|Female|20s|8|wavs/recorded_audio_sWpLH0A.webm|3
958|The Pioneer Room houses the Church of God and Warner University archival materials.|{transcription} said {user_id} in a {emotion} voice. Placing emphasis on {Church of God}.|Sad|2022-08-02 12:48:03.956974|Complete|Female|20s|8|wavs/recorded_audio_3HcoloC.webm|3
959|The main attraction for visitors is feeding giraffes from a raised observation platform.|With a {emotion} voice, {user_id} said {transcription}. Placing emphasis on {Word} and {Word}.|Sarcastic|2022-08-02 12:48:49.882959|Needs Updating|Female|20s|0|wavs/recorded_audio_8EXPsCj.webm|3
960|The mast first bent and then snapped at roughly half its height.|{transcription} said {user_id} in a {emotion} voice. Placing emphasis on {and then}.|Neutral|2022-08-02 12:49:54.873486|Complete|Female|20s|0|wavs/recorded_audio_GxjQfmb.webm|3
961|The lag can be hundreds of samples.|{transcription} said {user_id} in a {emotion} voice. Placing emphasis on {The lag}.|Angry|2022-08-02 12:50:14.113701|Complete|Female|20s|9|wavs/recorded_audio_v6ameNd.webm|3
962|In this case, the Lagrangian exhibits spontaneous symmetry breaking.|Placing emphasis on {In this case} and {Lagrangian}, {user_id} said {transcription}, in an {emotion} voice.|Disgust|2022-08-02 12:51:10.098336|Complete|Female|20s|3|wavs/recorded_audio_eMrj0w4.webm|3
963|It is located on Eastern Parkway near Underhill Avenue, close to Grand Army Plaza.|{transcription} said {user_id} in a {emotion} voice. Placing emphasis on {located}, {Eastern Parkway}, {Underhill Avenue} and {Grand}.|Happy|2022-08-02 12:51:44.026527|Complete|Female|20s|1|wavs/recorded_audio_yFTJzaP.webm|3
964|He had not a grain of physical fear.|{transcription} said {user_id} in a {emotion} voice. Placing emphasis on {not a grain}.|Happy|2022-08-02 12:52:32.088136|Complete|Female|20s|3|wavs/recorded_audio_k3pCycm.webm|3
965|His work was attacked by Daniel Whitby and Anthony Collins.|Placing emphasis on {attacked} and {and}, {user_id} said {transcription}, in an {emotion} voice.|Excited|2022-08-02 12:53:38.231256|Needs Updating|Female|20s|9|wavs/recorded_audio_xG2V63r.webm|3
966|He encouraged selflessness and hard work over competitiveness and idleness.|In an {emotion} voice, {user_id} says {transcription}. emphasising on {selflessness and hard work} and {competitiveness and idleness}.|Disgust|2022-08-02 12:57:12.346601|Complete|Female|20s|4|wavs/recorded_audio_iRsOr4B.webm|3
967|During the French intervention in Mexico, French food became popular with the upper classes.|Placing emphasis on {French}, {user_id} said {transcription}, in an {emotion} voice.|Neutral|2022-08-02 12:57:36.699620|Complete|Female|20s|0|wavs/recorded_audio_pxbIeP7.webm|3
968|"One of his children, who is ""passing"" for white, is targeted and harassed."|"{transcription} said {user_id} in a {emotion} voice. Placing emphasis on {children}, {""passing"" for white} and {and harassed}."|Angry|2022-08-02 12:58:04.038400|Complete|Female|20s|9|wavs/recorded_audio_osSBHAA.webm|3
969|Ogonori is typically eaten cold and is a source of the thickener agar.|{transcription} said {user_id} in a {emotion} voice. Placing emphasis on {and} and {source}.|Angry|2022-08-02 13:00:32.158464|Complete|Female|20s|7|wavs/recorded_audio_88KoZjr.webm|3
970|There is a small weekly newspaper in the town called The Heavener Ledger.|With a {emotion} voice, {user_id} said {transcription}. Placing emphasis on {small}.|Sad|2022-08-02 13:01:29.139022|Complete|Female|20s|8|wavs/recorded_audio_AoaJumj.webm|3
971|There he fought in the wars against the Apaches.|In an {emotion} voice, {user_id} says {transcription}. emphasising on {There} and {Apaches}.|Sarcastic|2022-08-02 13:01:52.751636|Complete|Female|20s|0|wavs/recorded_audio_d2hV4BQ.webm|3
972|Moderate democratic parties received most of the vote.|{user_id} said {transcription} With a {emotion} voice. Placing emphasis on {parties} and {most}.|Sarcastic|2022-08-02 13:02:16.730218|Complete|Female|20s|0|wavs/recorded_audio_8YWwPBA.webm|3
973|It was dramatic.|In an {emotion} voice, {user_id} says {transcription}. emphasising on {dramatic}.|Excited|2022-08-02 13:02:39.677016|Complete|Female|20s|8|wavs/recorded_audio_zax6QET.webm|3
974|Check-swinging can also be used in some warm-up exercises, such as the game pepper.|In an {emotion} voice, {user_id} says {transcription}. emphasising on {warm-up} and {Word}.|Happy|2022-08-02 13:03:00.196471|Complete|Female|20s|2|wavs/recorded_audio_inrn5at.webm|3
975|He also is the final combatant in the Monster open Tournament.|Placing emphasis on {He} and {Monster open Tournament}, {user_id} said {transcription}, in an {emotion} voice.|Surprised|2022-08-02 13:04:06.909882|Complete|Female|20s|6|wavs/recorded_audio_2qcr5bv.webm|3
976|Prazosin has also been found to be of value in some patients.|Placing emphasis on {of value}, {user_id} said {transcription}, in an {emotion} voice.|Excited|2022-08-02 13:05:22.659204|Complete|Female|20s|7|wavs/recorded_audio_R6T2Z25.webm|3
977|In the Japanese warfare, when the leaders fall, civilians would simply submit.|In an {emotion} voice, {user_id} says {transcription}. emphasising on {Japanese}, {fall} and {civilians}.|Happy|2022-08-02 13:06:43.556869|Complete|Female|20s|2|wavs/recorded_audio_lx0zYBq.webm|3
978|Many contemporary scholars, however, believe it was originally anonymous.|In an {emotion} voice, {user_id} says {transcription}. emphasising on {believe} and {originally anonymous}.|Excited|2022-08-02 13:08:19.509863|Complete|Female|20s|7|wavs/recorded_audio_C72syQb.webm|3
979|When the park was opened, the farmhouse was converted into a lodge.|Placing emphasis on {park}, {opened}, {farmhouse} and {lodge}, {user_id} said {transcription}, in an {emotion} voice.|Excited|2022-08-02 13:08:49.119617|Complete|Female|20s|8|wavs/recorded_audio_KkeDrQa.webm|3
980|Many of the songs on the album are duets with other artists.|In an {emotion} voice, {user_id} says {transcription}. emphasising on {duets} and {other artists}.|Sad|2022-08-02 13:09:10.615269|Complete|Female|20s|7|wavs/recorded_audio_BKjIYPm.webm|3
981|"Danny called the area ""Potlach Meadows""."|"With a {emotion} voice, {user_id} said {transcription}. Placing emphasis on {""Potlach Meadows""}."|Sarcastic|2022-08-02 13:10:09.869470|Complete|Female|20s|5|wavs/recorded_audio_Q0CCiET.webm|3
982|The snake attacks Harry and again they barely escape, but Harry's wand is destroyed.|Placing emphasis on {snake}, {and again}, {but Harry's} and {destroyed}, {user_id} said {transcription}, in an {emotion} voice.|Excited|2022-08-02 13:11:02.220681|Complete|Female|20s|9|wavs/recorded_audio_13GbSCo.webm|3
983|"Progress was made slowly until hours later ""Endurance"" encountered the pack once more."|In an {emotion} voice, {user_id} says {transcription}. emphasising on {was}, {hours} and {pack}.|Sarcastic|2022-08-02 13:11:30.206116|Complete|Female|20s|3|wavs/recorded_audio_WYV0exI.webm|3
984|A turtle hatchery located is located in Binoklutan.|{user_id} said {transcription} With a {emotion} voice. Placing emphasis on {turtle} and {located}.|Disgust|2022-08-02 13:13:36.908456|Complete|Female|20s|2|wavs/recorded_audio_joTUld0.webm|3
985|The reserve also has colonies of egrets, cormorants, and rare pelicans.|{user_id} said {transcription} With a {emotion} voice. Placing emphasis on {colonies} and {and rare}.|Surprised|2022-08-02 13:14:46.951373|Complete|Female|20s|6|wavs/recorded_audio_dbATP7v.webm|3
986|"More recently, the music to the movie ""Jaws"" exemplifies the minor second."|In an {emotion} voice, {user_id} says {transcription}. emphasising on {music to the movie} and {exemplifies the minor}.|Disgust|2022-08-02 13:15:20.042825|Complete|Female|20s|2|wavs/recorded_audio_Uk46fgo.webm|3
987|There is only one weekday round trip from the Hudson terminus.|With a {emotion} voice, {user_id} said {transcription}. Placing emphasis on {one weekday} and {Hudson terminus}.|Surprised|2022-08-02 13:17:10.260780|Complete|Female|20s|0|wavs/recorded_audio_aQPPtQ0.webm|3
988|The book is Shaw's eighteenth overall and his third collection of short stories.|Placing emphasis on {Shaw's eighteenth overall} and {third}, {user_id} said {transcription}, in an {emotion} voice.|Happy|2022-08-02 13:17:49.966750|Complete|Female|20s|1|wavs/recorded_audio_ULTeVXH.webm|3
989|"The phainopepla is particularly dependent on desert mistletoe, ""Phoradendron californicum""."|In an {emotion} voice, {user_id} says {transcription}. emphasising on {particularly} and {desert}.|Sarcastic|2022-08-02 13:21:17.319482|Complete|Female|20s|0|wavs/recorded_audio_4U19dbp.webm|3
990|Several composers have set the Seven Last Words to music.|Placing emphasis on {Seven Last Words}, {user_id} said {transcription}, in an {emotion} voice.|Sarcastic|2022-08-02 13:21:51.078692|Complete|Female|20s|0|wavs/recorded_audio_ohe0Ez6.webm|3
991|Several individuals are gathered on the beach.|With a {emotion} voice, {user_id} said {transcription}. Placing emphasis on {gathered} and {the beach}.|Sad|2022-08-02 13:22:12.882630|Complete|Female|20s|7|wavs/recorded_audio_LylE51q.webm|3
992|A classroom of young children holding a pose.|With a {emotion} voice, {user_id} said {transcription}. Placing emphasis on {young} and {pose}.|Happy|2022-08-02 13:22:49.654581|Complete|Female|20s|2|wavs/recorded_audio_Ne32pW4.webm|3
993|Performing is a passion for these dancers.|Placing emphasis on {Performing}, {user_id} said {transcription}, in an {emotion} voice.|Sarcastic|2022-08-02 13:23:07.001763|Complete|Female|20s|0|wavs/recorded_audio_QhGvJGL.webm|3
994|The Vinhos Verdes are light and fresh.|With a {emotion} voice, {user_id} said {transcription}. Placing emphasis on {light and fresh}.|Surprised|2022-08-02 13:25:58.776377|Complete|Female|20s|4|wavs/recorded_audio_6verQdd.webm|3
995|This is the most popular time at Camp Ware.|Placing emphasis on {This is}, {user_id} said {transcription}, in an {emotion} voice.|Sarcastic|2022-08-02 13:26:35.601740|Complete|Female|20s|1|wavs/recorded_audio_OMf8CEL.webm|3
996|Another beautiful place is the Gayathri Peedam, situated in Brindhaven.|With a {emotion} voice, {user_id} said {transcription}. Placing emphasis on {beautiful} and {situated}.|Neutral|2022-08-02 13:30:52.109814|Complete|Female|20s|0|wavs/recorded_audio_8aWgkuk.webm|3
997|State schedules may vary from federal schedules.|Placing emphasis on {schedules}, {vary} adn {federal}, {user_id} said {transcription}, in an {emotion} voice.|Sad|2022-08-02 13:31:13.588632|Complete|Female|20s|8|wavs/recorded_audio_FzhrP05.webm|3
998|The result was a near-doubling of speed.|{user_id} said {transcription} With a {emotion} voice. Placing emphasis on {doubling}.|Sarcastic|2022-08-02 13:31:57.282810|Complete|Female|20s|0|wavs/recorded_audio_CoDKkFU.webm|3
999|Kam Fong Chun was born in the Kalihi neighborhood of Honolulu, Hawaii.|In an {emotion} voice, {user_id} says {transcription}. emphasising on {Kalihi}.|Neutral|2022-08-02 13:33:50.849394|Complete|Female|20s|0|wavs/recorded_audio_KPPDndU.webm|3
1000|Minaminaka District was dissolved as a result of this merger.|In an {emotion} voice, {user_id} says {transcription}. emphasising on {dissolved} and {merger}.|Excited|2022-08-02 13:35:36.756050|Complete|Female|20s|7|wavs/recorded_audio_avW1Rio.webm|3
1001|They emphasize being casual and comfortable.|In an {emotion} voice, {user_id} says {transcription}. emphasising on {casual and comfortable}.|Disgust|2022-08-02 13:36:15.257299|Complete|Female|20s|3|wavs/recorded_audio_1iXbvx9.webm|3
1002|Yet, so complete was the design that it was worthy of preservation.|{user_id} said {transcription} With a {emotion} voice. Placing emphasis on {design}, {worthy} and {preservation}.|Excited|2022-08-02 13:36:48.419134|Complete|Female|20s|7|wavs/recorded_audio_o06YaOw.webm|3
