id|utterance|description|emotion|date_created|status|gender|age|level|audio_recording|user_id
311|The most important commercially-grown species is okra.|{transcription} said {user_id} in a {emotion} voice. Placing emphasis on {important}, {commercially-grown} and {species}.|Disgust|2022-07-11 11:51:29.207037|Complete|Female|20s|3|wavs/recorded_audio_zSVMDUF.webm|3
312|It is also known as epiphora and occasionally as antistrophe.|{transcription} said {user_id} in a {emotion} voice. Placing emphasis on {epiphora and occasionally}.|Surprised|2022-07-29 12:16:19.447046|Complete|Female|20s|2|wavs/recorded_audio_nbxl5YE.webm|3
313|The confession affirms that only Jesus Christ can be head of the church.|In an {emotion} voice, {user_id} says {transcription}. emphasising on {affirms}, {Jesus Christ} and {church}.|Sad|2022-07-11 11:57:17.295885|Complete|Female|20s|9|wavs/recorded_audio_P18Xs8n.webm|3
314|The general secretary of the party is K. Kandasamy.|With a {emotion} voice, {user_id} said {transcription}. Placing emphasis on {K. Kandasamy}.|Sarcastic|2022-07-11 11:59:34.300150|Complete|Female|20s|0|wavs/recorded_audio_fo1fFZ6.webm|3
315|Online gaming can become addictive to many gamers.|In an {emotion} voice, {user_id} says {transcription}. emphasising on {gaming} and {many}.|Neutral|2022-07-11 11:59:55.461785|Complete|Female|20s|0|wavs/recorded_audio_KtD7sAV.webm|3
316|They had walked together up the hill to the hotel.|{transcription} said {user_id} in a {emotion} voice. Placing emphasis on {together}, {the hill} and {hotel},|Disgust|2022-07-11 12:01:05.432239|Complete|Female|20s|2|wavs/recorded_audio_riq3c4b.webm|3
317|Wethermill leaned forward and shook his head with a smile.|In an {emotion} voice, {user_id} says {transcription}. emphasising on {leaned}, {and} and {with a smile}.|Disgust|2022-07-11 12:02:15.372839|Complete|Female|20s|2|wavs/recorded_audio_HXiAFP6.webm|3
318|He possessed a very warlike spirit.|In an {emotion} voice, {user_id} says {transcription}. emphasising on {possessed} and {warlike}.|Surprised|2022-07-11 12:02:41.512916|Complete|Female|20s|4|wavs/recorded_audio_Kzw46nZ.webm|3
319|Settlement in Caboolture was accelerated with the discovery of gold at Gympie.|Placing emphasis on {Caboolture}, {discovery} and {gold at Gympie}, {user_id} said {transcription}.|Surprised|2022-07-11 12:04:32.619338|Complete|Female|20s|3|wavs/recorded_audio_1L61v1Y.webm|3
320|He introduced ideas that indirectly challenged the discriminatory taxes imposed by Islamic authorities.|{transcription} said {user_id} in a {emotion} voice. Placing emphasis on {indirectly}.|Happy|2022-07-11 12:06:22.592562|Complete|Female|20s|1|wavs/recorded_audio_u2xubGw.webm|3
321|Menard began his career constructing pole buildings with friends from college.|In an {emotion} voice, {user_id} says {transcription}. emphasising on {Menard began}, {friends} and {college}.|Angry|2022-07-11 12:08:10.781536|Complete|Female|20s|7|wavs/recorded_audio_He9Mect.webm|3
322|They count Superman as well as Superwoman amongst their friends.|{transcription} said {user_id} in a {emotion} voice. Placing emphasis on {Superman as well as Superwoman} and {friends}.|Excited|2022-07-11 12:08:37.723851|Complete|Female|20s|7|wavs/recorded_audio_8Kz1gZi.webm|3
323|Some in the media panned the writing as amateurish.|Placing emphasis on {in the media} and {amateurish}, {user_id} said {transcription}.|Disgust|2022-07-11 12:09:35.325200|Complete|Female|20s|1|wavs/recorded_audio_pqr9AKM.webm|3
324|Several roads, towns, and cemeteries had to be relocated.|In an {emotion} voice, {user_id} says {transcription}. emphasising on {towns, and cemeteries} and {relocated}.|Angry|2022-07-11 12:10:36.580332|Complete|Female|20s|7|wavs/recorded_audio_2yelJJK.webm|3
325|Thomas Cromwell was the first editor of magazine.|{user_id} said {transcription} With a {emotion} voice. Placing emphasis on {first editor}.|Sad|2022-07-11 12:13:31.437495|Complete|Female|20s|6|wavs/recorded_audio_0qU1vGN.webm|3
326|More recently it has undergone extensive redevelopment with clubs, restaurants and media businesses.|{transcription} said {user_id} in a {emotion} voice. Placing emphasis on {More recently}, {extensive} and {and}.|Surprised|2022-07-11 12:14:09.626506|Complete|Female|20s|5|wavs/recorded_audio_DzKOzXK.webm|3
327|The child was immediately given to Lawayss' family.|In an {emotion} voice, {user_id} says {transcription}. emphasising on {child} and {Lawayss' family}.|Disgust|2022-07-11 12:15:49.151921|Complete|Female|20s|1|wavs/recorded_audio_EWn4z82.webm|3
328|The city of Turin honored the contributions that Ferraris made to science.|In an {emotion} voice, {user_id} says {transcription}. emphasising on {Turin} and {Ferraris made to}.|Disgust|2022-07-29 12:17:59.268359|Complete|Female|20s|3|wavs/recorded_audio_yg3VR1S.webm|3
329|Author Lewis describes Reid as a consummate artist of the black and white image.|Placing emphasis on {Reid} and {of the black and white}, {user_id} said {transcription}.|Sarcastic|2022-07-11 12:18:45.958893|Complete|Female|20s|0|wavs/recorded_audio_EkglHH3.webm|3
330|He pointed out the flaw in his brother’s argument.|Placing emphasis on {the flaw} and {argument}, {user_id} said {transcription}.|Excited|2022-07-11 12:19:15.459747|Complete|Female|20s|6|wavs/recorded_audio_DVCtQZM.webm|3
331|Is that program proprietary software, or is it open source?|Placing emphasis on {that program}, {or} and {open source}, {user_id} said {transcription}.|Surprised|2022-07-11 12:20:46.640935|Complete|Female|20s|5|wavs/recorded_audio_d4TCa5D.webm|3
332|The former mayor is giving a speech on Friday.|With a {emotion} voice, {user_id} said {transcription}. Placing emphasis on {former mayor} and {a speech}.|Angry|2022-07-11 12:21:10.842159|Complete|Female|20s|6|wavs/recorded_audio_lgdb7fI.webm|3
333|Only symmetric equilibria can be evolutionarily stable states in single population models.|{transcription} said {user_id} in a {emotion} voice. Placing emphasis on {symmetric}, {evolutionarily} and {in single}.|Neutral|2022-07-11 12:24:04.740919|Complete|Female|20s|0|wavs/recorded_audio_cn8xucN.webm|3
334|The Iron Guard was forced out of the government.|With a {emotion} voice, {user_id} said {transcription}.|Happy|2022-07-11 12:25:29.478574|Complete|Female|20s|2|wavs/recorded_audio_cenHauK.webm|3
335|The third vacancy was created after Alderman Rositano's death.|Placing emphasis on {The third} and {after Alderman Rositano's}, {user_id} said {transcription}.|Disgust|2022-07-11 12:28:08.072183|Complete|Female|20s|0|wavs/recorded_audio_F39yV2u.webm|3
336|The grips can be either wood or imitation mother-of-pearl handles.|In an {emotion} voice, {user_id} says {transcription}. emphasising on {wood} and {or imitation}.|Surprised|2022-07-11 12:28:54.811474|Complete|Female|20s|4|wavs/recorded_audio_cUVnXWo.webm|3
337|In the series Hogan sorts out problems for the locals.|With a {emotion} voice, {user_id} said {transcription}. Placing emphasis on {Hogan}.|Neutral|2022-07-11 12:29:56.712903|Complete|Female|20s|0|wavs/recorded_audio_t2jQjvR.webm|3
338|There is one free car parking area for this station.|In an {emotion} voice, {user_id} says {transcription}. emphasising on {one free} and {for this station}.|Excited|2022-07-11 12:30:42.114812|Complete|Female|20s|5|wavs/recorded_audio_9QXvddF.webm|3
339|Why don't you play and let's smash them?|{user_id} said {transcription} With a {emotion} voice. Placing emphasis on {let's smash them}.|Happy|2022-07-11 12:31:06.855283|Complete|Female|20s|0|wavs/recorded_audio_4HoFTXz.webm|3
340|Here, at last, he met with success, establishing a medical practice that prospered quickly.|{transcription} said {user_id} in a {emotion} voice. Placing emphasis on {Here}, {at last}, {success} and {prospered quickly}.|Disgust|2022-07-14 12:46:56.872201|Complete|Female|20s|5|wavs/recorded_audio_aDNcd43.webm|3
341|Adobe bricks are laid by course.|{user_id} said {transcription} With a {emotion} voice. Placing emphasis on {arelaid}.|Sad|2022-07-14 12:48:15.735299|Complete|Female|20s|6|wavs/recorded_audio_3cqiafG.webm|3
342|All of the British settlements north of Albany were accordingly abandoned.|Placing emphasis on {settlements}, {north of Albany} and {accordingly abandoned}, {user_id} said {transcription}.|Disgust|2022-07-14 12:49:45.935800|Complete|Female|20s|3|wavs/recorded_audio_BBGqB4N.webm|3
343|Joasaph is known to have authored a number of theological works.|In an {emotion} voice, {user_id} says {transcription}. emphasising on {Joasaph}, {a number} and {theological}.|Sad|2022-07-14 12:52:13.941503|Complete|Female|20s|6|wavs/recorded_audio_zkstsWP.webm|3
344|Young trees display upright oval growth, but the plants spread and mound with age.|{transcription} said {user_id} in a {emotion} voice. Placing emphasis on {Young trees} and {but}.|Sarcastic|2022-07-14 12:54:26.146642|Complete|Female|20s|3|wavs/recorded_audio_lLVQxcz.webm|3
345|The development is due to be completed within seven years.|{user_id} said {transcription} With a {emotion} voice. Placing emphasis on {within seven years}.|Sad|2022-07-14 12:55:01.156590|Complete|Female|20s|8|wavs/recorded_audio_TTKbqLs.webm|3
346|It lies within the City of Charles Sturt.|In an {emotion} voice, {user_id} says {transcription}.|Neutral|2022-07-14 12:56:35.170406|Complete|Female|20s|0|wavs/recorded_audio_PpLi2R5.webm|3
347|England and Yorkshire cricketer Paul Jarvis grew up in Marske.|{transcription} said {user_id} in a {emotion} voice. Placing emphasis on {England and Yorkshire} and {Marske}.|Happy|2022-07-14 12:57:49.868428|Complete|Female|20s|2|wavs/recorded_audio_Y74SPVJ.webm|3
348|It was created by trauma therapist Peter A. Levine.|{user_id} said {transcription} With a {emotion} voice. Placing emphasis on {trauma therapist Peter A. Levine}.|Excited|2022-07-14 12:58:36.300647|Complete|Female|20s|7|wavs/recorded_audio_dEDHHqZ.webm|3
349|No one noticed her.|{user_id} said {transcription} With a {emotion} voice.|Neutral|2022-07-14 12:59:05.572076|Complete|Female|20s|0|wavs/recorded_audio_85wBrWi.webm|3
350|We will not take up her early history.|{user_id} said {transcription} With a {emotion} voice. Placing emphasis on {not take up her}.|Surprised|2022-07-14 12:59:36.616877|Complete|Female|20s|3|wavs/recorded_audio_hj0SUNy.webm|3
351|Increment the order quantity if you require more than one item.|{user_id} said {transcription} With a {emotion} voice. Placing emphasis on {order quantity} and {one}.|Angry|2022-07-14 13:00:18.211213|Complete|Female|20s|8|wavs/recorded_audio_OKCThLO.webm|3
352|Along with Kerak, the castle owed sixty knights to the kingdom.|With a {emotion} voice, {user_id} said {transcription}. Placing emphasis on {kingdom}.|Neutral|2022-07-14 13:01:41.784608|Complete|Female|20s|0|wavs/recorded_audio_qKr0SVn.webm|3
353|"The first programme was ""The Morning Show with Alex Bell and Susan Morrison""."|In an {emotion} voice, {user_id} says {transcription}. emphasising on {first}, {The Morning Show}, {Susan}.|Sarcastic|2022-07-14 13:02:30.784706|Complete|Female|20s|0|wavs/recorded_audio_ce2lDcA.webm|3
354|He could not have stolen the animal.|In an {emotion} voice, {user_id} says {transcription}. emphasising on {not}.|Excited|2022-07-14 13:03:37.594625|Complete|Female|20s|6|wavs/recorded_audio_hTiLQGF.webm|3
355|He left his family so he could secretly develop and construct the Rescue System.|{user_id} said {transcription} With a {emotion} voice. Placing emphasis on {He left his family} and {secretly}.|Angry|2022-07-14 13:04:33.693069|Complete|Female|20s|7|wavs/recorded_audio_usgHd6v.webm|3
356|Pitts was called Kings' Crossing at the time.|{user_id} said {transcription} With a {emotion} voice. Placing emphasis on {Pitts}, {Kings' Crossing} and {at the time}.|Surprised|2022-07-29 12:19:12.173675|Complete|Female|20s|4|wavs/recorded_audio_g3CqEho.webm|3
357|Resnik is located at the northern edge of the dark area of the surface.|In an {emotion} voice, {user_id} says {transcription}. emphasising on {northern}, {dark area} and {surface}.|Disgust|2022-07-14 13:06:58.536169|Complete|Female|20s|3|wavs/recorded_audio_y6fBQsp.webm|3
358|Like all biblical names, Stephen has forms in all major world languages.|{transcription} said {user_id} in a {emotion} voice. Placing emphasis on {all} and {forms}.|Disgust|2022-07-14 13:07:57.856080|Complete|Female|20s|2|wavs/recorded_audio_uberf7h.webm|3
359|The staggered platforms are linked by footbridge.|{transcription} said {user_id} in a {emotion} voice. Placing emphasis on {platforms are linked}.|Sad|2022-07-14 13:08:40.825379|Complete|Female|20s|6|wavs/recorded_audio_qMpjT9A.webm|3
360|These schooners were used for nearby coastal trade of cotton, wheat and apples.|{user_id} said {transcription} With a {emotion} voice. Placing emphasis on {nearby} and {and}.|Disgust|2022-07-14 13:10:28.641974|Complete|Female|20s|2|wavs/recorded_audio_YTY08n1.webm|3
361|Hugh Lofting was educated at Mount Saint Mary's College in Spinkhill, Derbyshire.|Placing emphasis on {Mount Saint Mary's College}, {Spinkhill} and {Derbyshire}, {user_id} said {transcription}.|Excited|2022-07-14 13:13:02.618857|Complete|Female|20s|8|wavs/recorded_audio_IKHrAGi.webm|3
362|There is a large gap, or diastema, separating the cheek teeth from the incisors.|With a {emotion} voice, {user_id} said {transcription}. Placing emphasis on {large gap} and {the cheek}.|Neutral|2022-07-14 13:16:22.441028|Complete|Female|20s|0|wavs/recorded_audio_BguWtP7.webm|3
363|Canada requires tax deduction at source on payments of compensation by employers.|In an {emotion} voice, {user_id} says {transcription}. emphasising on {tax deduction}, {at source} and {compensation by employers}.|Disgust|2022-07-14 13:17:18.943089|Complete|Female|20s|3|wavs/recorded_audio_8AcCwf7.webm|3
364|But even finding the center of gravity of the sphere accurately was difficult.|{transcription} said {user_id} in a {emotion} voice.|Neutral|2022-07-14 13:19:07.138025|Complete|Female|20s|0|wavs/recorded_audio_OeaXVPR.webm|3
365|A river runs slightly west of Kajiki.|{transcription} said {user_id} in a {emotion} voice. Placing emphasis on {runs}.|Excited|2022-07-14 13:20:30.648101|Complete|Female|20s|7|wavs/recorded_audio_j5g00Yw.webm|3
366|He or she may hold a sword or wand, or other masculine symbol.|{user_id} said {transcription} With a {emotion} voice. Placing emphasis on {He or she}.|Neutral|2022-07-14 13:21:15.176775|Complete|Female|20s|0|wavs/recorded_audio_16eHFWy.webm|3
367|Lane and Monique are last seen kissing at home plate at Dodger Stadium.|With a {emotion} voice, {user_id} said {transcription}. Placing emphasis on {seen} and {home plate}.|Disgust|2022-07-14 13:21:51.892797|Complete|Female|20s|2|wavs/recorded_audio_wbmKWUG.webm|3
368|Absu mainman and drummer Proscriptor soon filled the vacant position.|In an {emotion} voice, {user_id} says {transcription}. emphasising on {and drummer Proscriptor}.|Excited|2022-07-14 13:22:32.501676|Complete|Female|20s|6|wavs/recorded_audio_9USS5MO.webm|3
369|Since then she has also acquired a substantial stake in Fairfax Media.|{transcription} said {user_id} in a {emotion} voice. Placing emphasis on {also}, {substantial} and {Fairfax Media}.|Excited|2022-07-14 13:23:18.317719|Complete|Female|20s|7|wavs/recorded_audio_0NKAqN3.webm|3
370|By this, Sun meant independence from imperialist domination.|{user_id} said {transcription} With a {emotion} voice. Placing emphasis on {By this} and {domination}.|Disgust|2022-07-14 13:25:36.331586|Complete|Female|20s|2|wavs/recorded_audio_wlQZ3iQ.webm|3
371|Koosharem is located in the Sevier School District and has one elementary school.|With a {emotion} voice, {user_id} said {transcription}. Placing emphasis on {Sevier School District} and {one}.|Excited|2022-07-14 13:28:53.502134|Complete|Female|20s|6|wavs/recorded_audio_naVVq6l.webm|3
372|They were hip to psychedelics as psychiatric medicine.|With a {emotion} voice, {user_id} said {transcription}. Placing emphasis on {hip} and {psychedelics as psychiatric}.|Surprised|2022-07-14 13:29:19.096095|Complete|Female|20s|4|wavs/recorded_audio_hS7CJm6.webm|3
373|Galmudug is another regional administration that emerged just south of Puntland.|Placing emphasis on {Galmudug}, {user_id} said {transcription}.|Neutral|2022-07-18 13:49:26.181695|Complete|Female|20s|0|wavs/recorded_audio_KAwaRAe.webm|3
374|Early variant names were Clarkville and Altoona.|With a {emotion} voice, {user_id} said {transcription}. Placing emphasis on {Early variant names} and {and}.|Excited|2022-07-18 13:51:51.719233|Complete|Female|20s|8|wavs/recorded_audio_WPSpopS.webm|3
375|When the perianth is in two whorls, it is described as biseriate.|With a {emotion} voice, {user_id} said {transcription}. Placing emphasis on {is in two whorls} and {biseriate}.|Angry|2022-07-18 14:01:57.805399|Complete|Female|20s|7|wavs/recorded_audio_lr22uTr.webm|3
376|Rainfall is very frequent in this part and the weather often changes quickly.|{transcription} said {user_id} in a {emotion} voice. Placing emphasis on {very}, {this part} {and} and {often}.|Sarcastic|2022-07-29 12:21:30.558958|Complete|Female|20s|3|wavs/recorded_audio_ZAwRbrx.webm|3
377|Little is known of this period in his life.|Placing emphasis on {known}, {period} and {life}, {user_id} said {transcription}.|Disgust|2022-07-14 13:34:03.079307|Complete|Female|20s|1|wavs/recorded_audio_jcgTbVc.webm|3
378|It is a feeder to the Southern Combination League Division Three.|{user_id} said {transcription} With a {emotion} voice. Placing emphasis on {Southern Combination League Division}.|Sad|2022-07-16 15:30:06.832730|Complete|Female|20s|6|wavs/recorded_audio_ab1eugB.webm|3
379|JavaScript supports implicit and explicit delegation.|With a {emotion} voice, {user_id} said {transcription}. Placing emphasis on {implicit}.|Neutral|2022-07-16 15:30:41.489654|Complete|Female|20s|0|wavs/recorded_audio_CdvlrFV.webm|3
380|Marta curry favored with her teacher to get better grades.|{user_id} said {transcription} With a {emotion} voice. Placing emphasis on {her teacher} and {better grades}.|Happy|2022-07-16 15:31:18.035558|Complete|Female|20s|5|wavs/recorded_audio_hpODKYw.webm|3
381|The alarm panel should have both a buzzer and an indicator light.|In an {emotion} voice, {user_id} says {transcription}. emphasising on {both}.|Neutral|2022-07-16 15:31:49.372605|Complete|Female|20s|0|wavs/recorded_audio_G77qFgX.webm|3
382|The Australian bulldog ants are among the biggest and most basal of ants.|{transcription} said {user_id} in a {emotion} voice. Placing emphasis on {biggest}, {and} and {basal}.|Happy|2022-07-18 14:03:10.046426|Complete|Female|20s|5|wavs/recorded_audio_mfYlIiG.webm|3
383|Aside from his father, his idol was Vancouver Canucks play-by-play broadcaster Jim Robson.|Placing emphasis on {Vancouver Canucks} and {Jim Robson}, {user_id} said {transcription}.|Excited|2022-07-18 14:05:49.939410|Complete|Female|20s|6|wavs/recorded_audio_QWGviBS.webm|3
384|They have toured North America, Europe, Australia, New Zealand and Japan.|With a {emotion} voice, {user_id} said {transcription}. Placing emphasis on {North America, Europe, Australia, New Zealand and Japan}.|Disgust|2022-07-16 15:35:05.800687|Complete|Female|20s|3|wavs/recorded_audio_fUwxcB7.webm|3
385|The National Park is located west of Esperance on the southern coast.|Placing emphasis on {National Park}, {west} and {southern coast}, {user_id} said {transcription}.|Excited|2022-07-18 14:07:11.729377|Complete|Female|20s|6|wavs/recorded_audio_QeemCpY.webm|3
386|The Court of Appeals denied this reasoning and upheld the conviction.|With a {emotion} voice, {user_id} said {transcription}. Placing emphasis on {denied} and {upheld the conviction}.|Angry|2022-07-16 15:36:17.211824|Complete|Female|20s|7|wavs/recorded_audio_4kRe4qD.webm|3
387|Saint Thomas also has many factories for food processing and electrical equipment.|{transcription} said {user_id} in a {emotion} voice. Placing emphasis on {many}, {and} and {electrical equipment}.|Sarcastic|2022-07-16 15:36:59.649796|Complete|Female|20s|2|wavs/recorded_audio_1l2mrE9.webm|3
388|"The title also appears as a line in ""One Year of Love""."|"With a {emotion} voice, {user_id} said {transcription}. Placing emphasis on {in} and {""One Year of Love""}."|Happy|2022-07-16 15:37:30.728751|Complete|Female|20s|3|wavs/recorded_audio_DNrVCqU.webm|3
389|In his youth my dad was a hooligan.|In an {emotion} voice, {user_id} says {transcription}.|Neutral|2022-07-16 15:42:04.854066|Complete|Female|20s|0|wavs/recorded_audio_kSDSxZh.webm|3
390|In all other instances the copular verb acts regularly.|{transcription} said {user_id} in a {emotion} voice. Placing emphasis on {all} and {acts regularly}.|Happy|2022-07-16 15:43:06.014790|Complete|Female|20s|3|wavs/recorded_audio_wC6dAsG.webm|3
391|"It has been described as ""a 'Turkey lobby' in Washington""."|"{transcription} said {user_id} in a {emotion} voice. Placing emphasis on {has been}{} and {""a 'Turkey lobby' in Washington""}."|Disgust|2022-07-16 15:44:02.435935|Complete|Female|20s|5|wavs/recorded_audio_xnaWjtl.webm|3
392|An entrepreneur is an example of a businessperson.|In an {emotion} voice, {user_id} says {transcription}. emphasising on {entrepreneur}.|Neutral|2022-07-29 12:23:09.612334|Complete|Female|20s|0|wavs/recorded_audio_9dOKLL0.webm|3
393|When playing the anthem, the music may be either live or recorded.|With a {emotion} voice, {user_id} said {transcription}. Placing emphasis on {may be} and {or}.|Neutral|2022-07-16 15:45:26.409847|Complete|Female|20s|0|wavs/recorded_audio_qFf6o1H.webm|3
394|Shark gill slits lie in a row behind the head.|Placing emphasis on {in a row} and {head}, {user_id} said {transcription}.|Excited|2022-07-16 15:45:57.218526|Complete|Female|20s|6|wavs/recorded_audio_2xhDSn8.webm|3
395|The working title of the programme was Eco-Challenge.|Placing emphasis on {The working title} and {Eco-Challenge}, {user_id} said {transcription}.|Surprised|2022-07-16 15:46:33.172946|Complete|Female|20s|5|wavs/recorded_audio_zIYcFyT.webm|3
396|The school operates at two levels: junior and senior school.|Placing emphasis on {two} and {junior}, {user_id} said {transcription}.|Happy|2022-07-16 15:48:08.696982|Complete|Female|20s|2|wavs/recorded_audio_pHms5lI.webm|3
397|He confessed and was sent to prison.|{user_id} said {transcription} With a {emotion} voice. Placing emphasis on {and was sent}.|Excited|2022-07-16 15:48:57.820807|Complete|Female|20s|6|wavs/recorded_audio_QJBoQsG.webm|3
398|Connolly undertook a tour of Germany, Austria and Hungary before starting at Oxford University.|In an {emotion} voice, {user_id} says {transcription}. emphasising on {Connolly undertook}, {Germany, Austria and Hungary}, {starting} and {Oxford University}.|Surprised|2022-07-16 15:50:40.125000|Complete|Female|20s|5|wavs/recorded_audio_CaEzjdS.webm|3
399|They are not currently performing.|In an {emotion} voice, {user_id} says {transcription}. emphasising on {not}.|Neutral|2022-07-16 15:51:10.164036|Complete|Female|20s|0|wavs/recorded_audio_TDxhJNu.webm|3
400|He never returned to school.|In an {emotion} voice, {user_id} says {transcription}. emphasising on {never} and {school}.|Angry|2022-07-16 15:54:03.715538|Complete|Female|20s|8|wavs/recorded_audio_CFbicnc.webm|3
401|The water flows through most of the cards of the Rider-Waite-Smith Tarot.|Placing emphasis on {flows}, {most}, {cards} and {Tarot}, {user_id} said {transcription}.|Excited|2022-07-16 15:54:51.848590|Complete|Female|20s|6|wavs/recorded_audio_TithtlC.webm|3
402|The rooms are designed to accommodate four women each.|Placing emphasis on {designed}, {four} and {each}, {user_id} said {transcription}.|Disgust|2022-07-16 15:55:38.093553|Complete|Female|20s|2|wavs/recorded_audio_ARsazfy.webm|3
403|These drugs may have systemic side effects including diabetes and pancreatitis.|{user_id} said {transcription} With a {emotion} voice. Placing emphasis on {systemic}.|Sarcastic|2022-07-16 15:58:38.109211|Complete|Female|20s|2|wavs/recorded_audio_nK3hZsb.webm|3
404|For pedestrians, the ferries remain free of charge.|In an {emotion} voice, {user_id} says {transcription}.|Neutral|2022-07-16 15:59:21.386319|Complete|Female|20s|0|wavs/recorded_audio_sb5ZruA.webm|3
405|Yam is also extensively cultivated throughout the city.|Placing emphasis on {Yam}, {also} and {throughout}, {user_id} said {transcription}.|Excited|2022-07-16 16:01:16.346583|Complete|Female|20s|8|wavs/recorded_audio_XdllwSL.webm|3
406|Others do not behave as clearly like monosyllabic diphthongs.|Placing emphasis on {do not behave}, {user_id} said {transcription}.|Excited|2022-07-29 12:25:32.406942|Complete|Female|20s|7|wavs/recorded_audio_SFiwyqY.webm|3
407|The island is northwest of the Salisbury Beach State Reservation.|With a {emotion} voice, {user_id} said {transcription}. Placing emphasis on {island}, {northwest} and {Salisbury Beach State Reservation}.|Angry|2022-07-16 16:03:36.758986|Complete|Female|20s|7|wavs/recorded_audio_YJ9hASM.webm|3
408|He studied naval medicine in Bordeaux.|With a {emotion} voice, {user_id} said {transcription}. Placing emphasis on {studied}.|Happy|2022-07-16 16:04:04.700035|Complete|Female|20s|5|wavs/recorded_audio_E6ds5Jg.webm|3
409|Initially she worked with Ian Garrow arranging his escape route over the Pyrenees.|{user_id} said {transcription} With a {emotion} voice. Placing emphasis on {Ian Garrow}, {escape route} and {Pyrenees}.|Angry|2022-07-18 14:09:55.060581|Complete|Female|20s|8|wavs/recorded_audio_ziejPvS.webm|3
410|It was named for Jefferson County pioneer, Joseph Barnett.|In an {emotion} voice, {user_id} says {transcription}. emphasising on {Jefferson County pioneer} and {Joseph Barnett}.|Disgust|2022-07-18 14:11:49.348270|Complete|Female|20s|4|wavs/recorded_audio_d9lKR5z.webm|3
